{
  "schema_version": "claim_extract.v1",
  "market_id": "market-election-2026",
  "generated_at": "2026-02-11T12:00:00Z",
  "claims": [
    {
      "claim_text": "Election officials plan to certify by January 15, 2027.",
      "stance": "support",
      "confidence": 0.72,
      "sources": [
        {
          "url": "https://www.reuters.com/world/us/example-election-story",
          "title": "Reuters timeline",
          "published_at": "2026-02-11T10:00:00Z"
        }
      ]
    }
  ]
}
